{
  "metadata": {
    "qegVersion": "0.2",
    "runId": "qeg:run-positive-placement-change-retirement",
    "createdAt": "2026-07-02T00:00:00.000Z",
    "profile": "ipo_controlled",
    "inputArtifacts": [
      {
        "id": "qeg:artifact-positive-placement-change-retirement",
        "adapter": "qeg-native",
        "kind": "test_model",
        "path": "artifacts/input.json",
        "contentHash": "sha256:ee4e3d131531183991b409e2952fb46350ccc4e6fdd0c6fe8c746b7519a15a62",
        "revision": "aaaaaaaaaaaaaaaaaaaaaaaaaaaaaaaaaaaaaaaa"
      }
    ],
    "requiredConnectorStatus": {
      "qeg-native": "success"
    },
    "headRef": "aaaaaaaaaaaaaaaaaaaaaaaaaaaaaaaaaaaaaaaa"
  },
  "obligations": [
    {
      "id": "qeg:obligation-login",
      "requirementIds": [],
      "riskIds": [
        "qeg:risk-login-regression"
      ],
      "failureModeIds": [],
      "changedCodeIds": [],
      "priority": "P1",
      "riskPriorityIndex": 10,
      "gateRelevance": "blocking",
      "traceability": {
        "sourceRefs": [
          {
            "id": "qeg:sr-obligation-login",
            "path": "placement/obligations/login.json"
          }
        ],
        "assumptions": [],
        "confidence": "high"
      }
    }
  ],
  "placements": [
    {
      "id": "qeg:placement-login-manual-original",
      "kind": "test_placement",
      "title": "Original manual login case placement",
      "traceability": {
        "sourceRefs": [
          {
            "id": "qeg:sr-placement-login",
            "path": "placement/original/login-manual.json"
          }
        ],
        "assumptions": [],
        "confidence": "high"
      },
      "sourceArtifactIds": [],
      "obligationId": "qeg:obligation-login",
      "primaryLayer": "manual-scripted",
      "disposition": "manual-only",
      "gateRelevance": "blocking",
      "candidateScores": [],
      "selectedTestIds": [
        "mbb:CASE-login-001"
      ]
    }
  ],
  "placement_changes": [
    {
      "id": "qeg:placement-change-login-retirement",
      "subject_id": "mbb:CASE-login-001",
      "from_layer": "manual-scripted",
      "to_layer": "automated",
      "replacement_ids": [
        "hate:AETE-login-001"
      ],
      "evidence_refs": [
        {
          "id": "hate:ev-login-green",
          "path": "hate/reports/login-aete.json",
          "evidenceKind": "test_result",
          "capturedAt": "2026-07-02T00:00:00.000Z"
        }
      ],
      "policy_ref": "qeg:policy-ipo-controlled-001",
      "decided_by": "reviewer-001",
      "decided_at": "2026-07-02T00:00:00.000Z",
      "reversible": true,
      "revert_condition": "replacement evidenceStrength < 0.9 or recentGreenRuns < 3 or risk coverage missing"
    }
  ],
  "manual_case_inventory": {
    "previous_subject_ids": [
      "mbb:CASE-login-001"
    ],
    "current_subject_ids": [],
    "sourceRefs": [
      {
        "id": "mbb:sr-manual-inventory",
        "path": "manual-bb/manual-case-inventory.json"
      }
    ]
  }
}
